{
  "schema_version": "textbookeval-case-v0.1",
  "case_id": "pilot3_lesson_004",
  "lesson_id": "lesson_004",
  "status": "frozen",
  "dataset_version": "textbookeval-v1-pilot3-git-reissued-20260911",
  "source": {
    "files": [
      {
        "role": "source_json",
        "path": "source/source.json",
        "sha256": "87eb9663fc7d2407dd092af0f3e9b0268a9c66133399c19405dd6958113b7861",
        "required": true
      },
      {
        "role": "source_pdf",
        "path": "source/source.pdf",
        "sha256": "a65c0c74167cb5783d501d120991334758f0230ffd063df10d2e37afad276862",
        "required": true
      },
      {
        "role": "source_manifest",
        "path": "source/manifest.json",
        "sha256": "0281c61b38519c95cb560c6ec698b272c681b4cd624dcf120d08c02d73abf550",
        "required": true
      },
      {
        "role": "source_image_01",
        "path": "source/images/fig4-9_联合国产业分类.png",
        "sha256": "83e17afbf231781ad5cc9b437ee256cbc194303c0e27f4df61dd0860d6e40c86",
        "required": true
      }
    ]
  },
  "annotation": {
    "role": "annotation",
    "path": "private/annotation.json",
    "sha256": "951573f69a2a2c0b22656b6099ac6c76e39afae05ba5b61f43ba2e0a1a612c8b",
    "required": true,
    "review_status": "frozen"
  },
  "heldout_questions": {
    "role": "heldout_questions",
    "path": "private/heldout_questions.json",
    "sha256": "1dd5580ea6decf95a18ad347f063010304db8e044121625135af42a51e55cff9",
    "required": true,
    "review_status": "frozen"
  },
  "expected": {
    "title": "数字经济 - 四、我国发展数字经济的优势",
    "source_type": "docx",
    "source_locator": "docx:chapter=5;section=3",
    "paragraph_count": 10,
    "image_count": 1,
    "heldout_question_count": 6
  },
  "systems": {
    "baseline": {
      "system_id": "internal_C01",
      "run_config": {
        "path": "run_config.json",
        "sha256": "f1195e7beb0b8393393d8993ee1575bc55549340365fa9fa834bcba8fdc2810e"
      }
    }
  },
  "baseline_artifacts": {
    "storyboard": {
      "path": "storyboard.json",
      "sha256": "a273d133f67a2d2b2bebb72d35900e4f4c48d2a6f4b6cfe7cbb34ba9058dd2ac"
    },
    "timed_storyboard": {
      "path": "storyboard_timed.json",
      "sha256": "a273d133f67a2d2b2bebb72d35900e4f4c48d2a6f4b6cfe7cbb34ba9058dd2ac"
    },
    "html": {
      "path": "animation.html",
      "sha256": "1957d20d66e83898905750f557232c90a8d203a7feca55c1b582fba0a0d852fe"
    },
    "layout_report": {
      "path": "storyboard.layout.json",
      "sha256": "5b308f20df7c5e83adb627ddbbf4fd23a448d869ba9f147c3030f3764a743815"
    },
    "subtitle": {
      "path": "subtitles.srt",
      "sha256": "405d6198829ea76b5a5e9355e0e0d80f70ece61601c4212bd539888f696bb2e5"
    },
    "lesson_plan": {
      "path": "lesson_plan.json",
      "sha256": "b3f497e65e04972c795a8d886ba126f3bb5a0885e1ccdd82680052ff26107304"
    },
    "script": {
      "path": "script.txt",
      "sha256": "dceeaa28aa9b83942f2310fcdf9194609e0b504488d5da7f31fa4a2b7b29d8e5"
    },
    "run_config": {
      "path": "run_config.json",
      "sha256": "f1195e7beb0b8393393d8993ee1575bc55549340365fa9fa834bcba8fdc2810e"
    },
    "run_status": {
      "path": "run_status.json",
      "sha256": "622143da1e66223ee3f92bfcf12a3dd6e4e98e4eacf1706f0f2533addfd7eecf"
    },
    "animation_manifest": {
      "path": "animation.manifest.json",
      "sha256": "8c38e9ed8df460fb0940523546db763e8b75a985a28fbb2c78a0b42796af8451"
    },
    "vlm_readability_result": {
      "path": "vlm_readability_result.json",
      "sha256": "66c28d56e2e898536465b5c4a5d4d6163291f9fff1fc03ac9054e67f92df19fc"
    },
    "videoqa_audience_result": {
      "path": "videoqa_audience_result.json",
      "sha256": "440a810ce9c1e5493a2879c51e2691d10c5e5d727a15378bb3fe6f0e84b70dc0"
    },
    "videoqa_reference_result": {
      "path": "videoqa_reference_result.json",
      "sha256": "a2be9fa75c5fe0bd002fc9189215f96b06169747cfcb9e6d9c27d57ded770fed"
    },
    "storyboard_image_01": {
      "path": "images/fig4-9_联合国产业分类.png",
      "sha256": "83e17afbf231781ad5cc9b437ee256cbc194303c0e27f4df61dd0860d6e40c86"
    }
  },
  "metadata": {
    "selected_for_pilot3": true,
    "prepared_at": "2026-09-09",
    "source_review_status": "frozen",
    "annotation_status": "frozen",
    "freeze_blocked": false,
    "baseline_attached": true,
    "baseline_provenance": "/ai/data/textbook-to-video/experiments/presentagent-comparison-v1/runs/internal_a16_20260808/lesson_004/P0/formal/C01",
    "freeze_approval": {
      "reviewer": "A-eval-owner",
      "reviewed_at": "2026-09-10T05:55:31.338490+00:00",
      "basis": "Project owner explicitly approved lesson_001, lesson_002 and lesson_004 for the pilot3 benchmark on 2026-09-10."
    },
    "provenance_status": "reissued_from_published_git_copy",
    "provenance_source": "datasets/pilot3/freeze_record.json",
    "provenance_source_sha256": "3293c0c44397e16c8f4b6a1335d5c3cd7fa4a80638c651ea84ecbe3a93991244",
    "provenance_git_commit": "2c5300f",
    "provenance_note": "Original external frozen bytes are unavailable in this environment. This revision preserves the A-published frozen semantic content and records the exact SHA-256 of the portable Git copy; the original freeze record is retained as historical provenance and is not overwritten."
  },
  "review": {
    "annotation_status": "frozen",
    "reviewer": "A-eval-owner",
    "reviewed_at": "2026-09-10T05:55:31.338490+00:00",
    "notes": "Project owner explicitly approved lesson_001, lesson_002 and lesson_004 for the pilot3 benchmark on 2026-09-10."
  }
}
